{
  "claim_limits": [
    "Results apply only to the tested model/configuration and corpus.",
    "The evaluation is not a security certification.",
    "Completed holdouts become development/public-regression data once disclosed and must not be reused as unseen evidence.",
    "No statistical claim should exceed what 12 holdout cases, 3 development cases, 3 repetitions, 2 target model configurations, and 2 model graders support.",
    "Temperature-zero repetitions are observations, not guaranteed independent statistical trials."
  ],
  "corpus_version": "0.1.0",
  "evaluation_date_utc": "2026-09-04",
  "generic_security_control": {
    "composition": "The non-SPIFFE generic control text was appended to the exact SPIFFE_SPIRE_BASE packet.",
    "condition_had_spiffe_specific_material": true,
    "control_text_bytes": 12393,
    "control_text_contains_spiffe_specific_material": false,
    "control_text_path": "WITHHELD_RIGHTS_NOT_ESTABLISHED",
    "control_text_publication": "DIGEST_AND_METADATA_ONLY",
    "control_text_sha256": "a40a05d76f6dbba471e718b9db7c64c5c07870320ec0267f80f9e3f78d210ccc",
    "control_text_token_count": "NOT_RECORDED",
    "control_text_words": 1673,
    "license": "NOT_RECORDED",
    "size_matching": {
      "combined_generic_packet": {
        "bytes": 38319,
        "words": 4971
      },
      "difference_words": -75,
      "generic_addition_words": 1673,
      "method": "word-count proximity to the pre-tuning adjudicated addition; tokenizer-token matching was not recorded",
      "post_tuning_note": "The generic control was not re-expanded after the compact PR revision; it was 2051 bytes and 196 words shorter than the revised packet.",
      "pre_tuning_adjudicated_addition_words": 1748,
      "pre_tuning_adjudicated_packet": {
        "bytes": 39562,
        "words": 5043
      },
      "revised_adjudicated_packet": {
        "bytes": 40370,
        "words": 5167
      }
    }
  },
  "grader_disagreement_handling": {
    "aggregate_score": "The four averaged base dimensions were summed per response, then response totals were arithmetically averaged within each corpus/model/condition cell.",
    "boolean_flags": "Mean-judge, per-grader, both-grader, and either-grader rates were retained. The headline tables used mean-judge rates; disagreements were not collapsed by majority vote.",
    "dimension_scores": "For each response and dimension, the two integer scores were averaged with equal weight.",
    "inter_rater": {
      "dimension_comparisons": 1800,
      "exact_agreement_rate": 0.8244,
      "mean_absolute_difference_on_0_to_2_scale": 0.1878
    },
    "manual_or_third_grader_resolution": false
  },
  "grader_prompt": {
    "base_rubric_sha256": "31c5c36861fdd1c789b595ca3f79fe07fc19b8f6aa7808258e1be5b15f02b15e",
    "batch_count": 30,
    "codex_combined_stdin_prompt_digest_map_sha256": "c0e7f7a0526af6435c9b314a2afc5a94e810f12db41e0c149c08c2abf4695557",
    "construction_source": "post_score_harness.py at the frozen scoring-harness SHA-256",
    "digest_map_canonicalization": "SHA-256 of JSON object mapping batch_id to exact prompt SHA-256, serialized with sorted keys and separators ',' and ':'",
    "grader_system_prompt": {
      "bytes": 1462,
      "sha256": "8c0a448724e4f0927842b355b7f56e11d753d3e779ce00ded15a5049cfe3baae"
    },
    "note": "There is no single full grading prompt because scenario and anonymous responses vary by batch. Both graders received semantically identical system, rubric, scenario/answer-key, and anonymous-response material; Qwen received system and user messages separately, while Codex received their concatenation on stdin.",
    "responses_per_batch": 12,
    "user_prompt_digest_map_sha256": "71cf0d37e887aba5eb4f4068fbcf63c9ca2d1093ed1ddfc426e162d3edf6d91f"
  },
  "graders": [
    {
      "artifacts_not_visible": [
        "private identity mapping",
        "target provider label",
        "condition label",
        "repetition number",
        "target run identifier",
        "condition reference packet as a separately labeled artifact"
      ],
      "artifacts_visible": [
        "base scoring rubric",
        "full scenario including expected conclusions, must_not rules, authority guidance, finding threshold, and expected claim",
        "12 anonymous target responses from the same scenario",
        "claim-label vocabulary",
        "grading output schema"
      ],
      "blinding_limits": "Provider, condition, repetition, and run identifier were removed. Response prose could still contain stylistic or reference-content clues.",
      "effort_level": "NOT_APPLICABLE_OR_NOT_RECORDED",
      "exact_model_identifier": "qwen38-27b-dflash2",
      "grading_calls": 30,
      "grading_prompt_digests": {
        "per_batch_user_prompt_digest_map_sha256": "71cf0d37e887aba5eb4f4068fbcf63c9ca2d1093ed1ddfc426e162d3edf6d91f",
        "system_sha256": "8c0a448724e4f0927842b355b7f56e11d753d3e779ce00ded15a5049cfe3baae"
      },
      "ground_truth_visible": true,
      "max_output_tokens": 8000,
      "model_identity_and_condition_blinded": true,
      "model_revision_or_weights_hash": "NOT_RECORDED",
      "other_sampling_settings": "NOT_EXPLICITLY_CONFIGURED; server defaults are UNKNOWN",
      "provider": "Qwen",
      "quantization_and_build": "NOT_RECORDED_FOR_GRADER_CALLS",
      "reasoning_or_thinking": {
        "api_setting": "chat_template_kwargs.enable_thinking=false",
        "mode": "no_think",
        "observed_reasoning_tokens": 0
      },
      "request_timeout_seconds": 420,
      "response_level_grades": 360,
      "runtime": "OpenAI-compatible chat-completions endpoint; exact grader deployment stack not persisted",
      "scored_same_model_outputs": {
        "count": 180,
        "identity_was_blinded": true,
        "yes": true
      },
      "temperature": 0,
      "tool_access": "No tools supplied; prompt forbade tools and browsing; observed tool events: 0.",
      "top_p": "NOT_EXPLICITLY_CONFIGURED",
      "underlying_model_and_version": "UNKNOWN"
    },
    {
      "artifacts_not_visible": [
        "private identity mapping",
        "target provider label",
        "condition label",
        "repetition number",
        "target run identifier",
        "condition reference packet as a separately labeled artifact"
      ],
      "artifacts_visible": [
        "base scoring rubric",
        "full scenario including expected conclusions, must_not rules, authority guidance, finding threshold, and expected claim",
        "12 anonymous target responses from the same scenario",
        "claim-label vocabulary",
        "grading output schema"
      ],
      "blinding_limits": "Provider, condition, repetition, and run identifier were removed. Response prose could still contain stylistic or reference-content clues.",
      "effort_level": "medium",
      "exact_model_identifier": "gpt-5.6-sol",
      "execution_mode": {
        "ephemeral": true,
        "ignore_user_config": true,
        "ignore_workspace_rules": true,
        "reasoning_effort": "medium",
        "sandbox": "read-only",
        "skip_git_repository_check": true,
        "working_directory": "new isolated workspace per grading call"
      },
      "grading_calls": 30,
      "grading_prompt_digests": {
        "per_batch_combined_stdin_prompt_digest_map_sha256": "c0e7f7a0526af6435c9b314a2afc5a94e810f12db41e0c149c08c2abf4695557",
        "system_sha256": "8c0a448724e4f0927842b355b7f56e11d753d3e779ce00ded15a5049cfe3baae"
      },
      "ground_truth_visible": true,
      "max_output_tokens": "NOT_RECORDED",
      "model_identity_and_condition_blinded": true,
      "model_revision_or_weights_hash": "NOT_RECORDED",
      "other_sampling_settings": "NOT_RECORDED",
      "provider": "OpenAI",
      "reasoning_or_thinking": "reasoning enabled",
      "request_timeout_seconds": 900,
      "response_level_grades": 360,
      "runtime": "Codex CLI 0.151.0 using codex exec",
      "scored_same_model_outputs": {
        "count": 180,
        "identity_was_blinded": true,
        "yes": true
      },
      "temperature": "NOT_RECORDED",
      "tool_access": "Read-only Codex sandbox; prompt forbade tools and browsing; observed tool events: 0.",
      "top_p": "NOT_RECORDED"
    }
  ],
  "missing_reproducibility_fields": [
    {
      "field": "Qwen upstream model identity and immutable weights revision/hash",
      "impact": "The served alias alone does not uniquely identify the base weights.",
      "status": "UNKNOWN_OR_NOT_RECORDED"
    },
    {
      "field": "Qwen exact quantization recipe, dflash2 build definition, SGLang version/commit, kernels, drivers, accelerator model, and serving defaults",
      "impact": "NVFP4, dflash2, and TP2 are known for target calls, but the executable serving stack is not reproducible from those labels alone.",
      "status": "PARTIALLY_RECORDED"
    },
    {
      "field": "Qwen grader deployment recipe and quantization",
      "impact": "The grader persisted the served alias but not the deployment metadata.",
      "status": "NOT_RECORDED"
    },
    {
      "field": "Qwen omitted sampler defaults and inference seed",
      "impact": "top_p, top_k, and server defaults may affect reproduction even at temperature zero.",
      "status": "NOT_RECORDED"
    },
    {
      "field": "OpenAI gpt-5.6-sol immutable backend revision/model snapshot",
      "impact": "The public model name and CLI version do not identify a fixed service-side model snapshot.",
      "status": "NOT_RECORDED"
    },
    {
      "field": "Codex/OpenAI temperature, top_p, seed, max output tokens, and other backend request defaults",
      "impact": "The CLI command fixed model and reasoning effort but did not freeze these inference parameters.",
      "status": "NOT_RECORDED"
    },
    {
      "field": "Actual target and grader worker counts and exact invocation command lines",